### ISSUE TITLE
ip mptcp monitor reports: [SF_CLOSED]  error=111

### ISSUE THREAD

**Issue by dmytroshytyi** [multipath-tcp/mptcp_net-next#338]
Hello,

I'im curious what I'm missing in this setup, such that I observe an interesting behavior of sublflow  [SF_CLOSED]  error=111

I'm runing the next kernel:
```
Linux debian 6.2.0-rc3-g02e586
```
IPERF is using IPPROTO_MPTCP.

Testbed setup:
```
sysctl -w net.ipv4.conf.all.rp_filter=0
ip netns exec ns1 sysctl -w net.ipv4.conf.all.rp_filter=0
ip netns exec ns2 sysctl -w net.ipv4.conf.all.rp_filter=0
ip netns add ns1
ip netns add ns2

ip link add dev veth1 type veth peer name veth2
ip link set veth1 netns ns1
ip link set veth2 netns ns2
ip netns exec ns1 ip link set veth1 up
ip netns exec ns2 ip link set veth2 up

ip link add dev veth3 type veth peer name veth4
ip link set veth3 netns ns1
ip link set veth4 netns ns2
ip netns exec ns1 ip link set veth3 up
ip netns exec ns2 ip link set veth4 up

ip netns exec ns1 ip addr add 10.1.1.1/24 dev veth1
ip netns exec ns2 ip addr add 10.1.1.2/24 dev veth2

ip netns exec ns1 ip addr add 10.2.2.1/24 dev veth3
ip netns exec ns2 ip addr add 10.2.2.2/24 dev veth4

sysctl -w net.mptcp.enabled=1
ip netns exec ns1 sysctl -w net.mptcp.enabled=1
ip netns exec ns2 sysctl -w net.mptcp.enabled=1

ip netns exec ns1 ip mptcp limits set subflow 4 add_addr_accepted 4
ip netns exec ns2 ip mptcp limits set subflow 4 add_addr_accepted 4

ip netns exec ns1 ip mptcp endpoint add 10.1.1.1 singal
ip netns exec ns1 ip mptcp endpoint add 10.2.2.1 subflow

ip netns exec ns2 ip mptcp endpoint add 10.1.1.2 subflow
ip netns exec ns2 ip mptcp endpoint add 10.2.2.2 subflow

ip netns exec ns1 ip mptcp endpoint change id 1 fullmesh
ip netns exec ns1 ip mptcp endpoint change id 2 fullmesh

ip netns exec ns2 ip mptcp endpoint change id 1 fullmesh
ip netns exec ns2 ip mptcp endpoint change id 2 fullmesh
```
here is a result of:
```
ip netns exec ns2 ip mptcp monitor
```
```
[         CREATED] token=8b48782d remid=0 locid=0 saddr4=10.1.1.2 daddr4=10.1.1.1 sport=5201 dport=34172
[     ESTABLISHED] token=8b48782d remid=0 locid=0 saddr4=10.1.1.2 daddr4=10.1.1.1 sport=5201 dport=34172
[       SF_CLOSED] token=8b48782d remid=0 locid=2 saddr4=10.2.2.2 daddr4=10.1.1.1 sport=54459 dport=34172 backup=0 error=111
[  SF_ESTABLISHED] token=8b48782d remid=1 locid=0 saddr4=10.1.1.2 daddr4=10.2.2.1 sport=5201 dport=36341 backup=0
```
tcpdump packet trace:
```
root@debian:~# tcpdump -r tcpdump.out
reading from file tcpdump.out, link-type EN10MB (Ethernet), snapshot length 262144
17:14:39.184427 IP 10.1.1.1.33698 > 10.1.1.2.5201: Flags [S], seq 3162591244, win 64240, options [mss 1460,sackOK,TS val 4156713656 ecr 0,nop,wscale 7,mptcp capable v1], length 0
17:14:39.184719 IP 10.1.1.2.5201 > 10.1.1.1.33698: Flags [S.], seq 883817254, ack 3162591245, win 65160, options [mss 1460,sackOK,TS val 1055423805 ecr 4156713656,nop,wscale 7,mptcp capable v1 {0x5bf4dbf627bfd69b}], length 0
17:14:39.184961 IP 10.1.1.1.33698 > 10.1.1.2.5201: Flags [.], ack 1, win 502, options [nop,nop,TS val 4156713657 ecr 1055423805,mptcp capable v1 {0x22fc33ed9d78b9e7,0x5bf4dbf627bfd69b}], length 0
17:14:39.185878 IP 10.1.1.1.33698 > 10.1.1.2.5201: Flags [P.], seq 1:38, ack 1, win 502, options [nop,nop,TS val 4156713658 ecr 1055423805,mptcp capable v1 {0x22fc33ed9d78b9e7,0x5bf4dbf627bfd69b},nop,nop], length 37
17:14:39.187947 IP 10.2.2.2.45295 > 10.1.1.1.33698: Flags [S], seq 2615335073, win 64240, options [mss 1460,sackOK,TS val 1392569733 ecr 0,nop,wscale 7,mptcp join id 2 token 0x400b22a3 nonce 0xf61b5a0d], length 0
17:14:39.188037 IP 10.1.1.2.5201 > 10.1.1.1.33698: Flags [.], ack 38, win 509, options [nop,nop,TS val 1055423808 ecr 4156713658,mptcp dss ack 4896219234535800030], length 0
17:14:39.188773 IP 10.2.2.1.50129 > 10.1.1.2.5201: Flags [S], seq 3149764674, win 64256, options [mss 1460,sackOK,TS val 806476618 ecr 0,nop,wscale 7,mptcp join id 1 token 0x85607bdd nonce 0x83d85447], length 0
17:14:39.192757 IP 10.2.2.1.50129 > 10.1.1.2.5201: Flags [.], ack 4202612640, win 502, options [nop,nop,TS val 806476622 ecr 1101702215,mptcp join hmac 0xf94748cc0415dade7dceafc5a973dc83b9a52b6c], length 0
17:14:39.192819 IP 10.1.1.2.5201 > 10.1.1.1.33698: Flags [P.], seq 1:2, ack 38, win 509, options [nop,nop,TS val 1055423813 ecr 4156713658,mptcp dss ack 4896219234535800030 seq 16737065810017587888 subseq 1 len 1,nop,nop], length 1
17:14:39.192992 IP 10.1.1.1.33698 > 10.1.1.2.5201: Flags [.], ack 2, win 502, options [nop,nop,TS val 4156713665 ecr 1055423813,mptcp dss ack 16737065810017587889], length 0
17:14:39.198951 IP 10.1.1.1.33698 > 10.1.1.2.5201: Flags [P.], seq 38:42, ack 2, win 502, options [nop,nop,TS val 4156713671 ecr 1055423813,mptcp dss ack 16737065810017587889 seq 4896219234535800030 subseq 38 len 4,nop,nop], length 4
17:14:39.199426 IP 10.2.2.1.50129 > 10.1.1.2.5201: Flags [P.], seq 0:124, ack 1, win 502, options [nop,nop,TS val 806476629 ecr 1101702220,mptcp dss ack 16737065810017587889 seq 4896219234535800034 subseq 1 len 124,nop,nop], length 124
17:14:39.199823 IP 10.1.1.2.5201 > 10.1.1.1.33698: Flags [P.], seq 2:3, ack 42, win 510, options [nop,nop,TS val 1055423820 ecr 4156713671,mptcp dss ack 4896219234535800158 seq 16737065810017587889 subseq 2 len 1,nop,nop], length 1
17:14:39.208379 IP 10.1.1.1.33710 > 10.1.1.2.5201: Flags [S], seq 2806776094, win 64240, options [mss 1460,sackOK,TS val 4156713681 ecr 0,nop,wscale 7,mptcp capable v1], length 0
17:14:39.208616 IP 10.1.1.2.5201 > 10.1.1.1.33710: Flags [S.], seq 1795498117, ack 2806776095, win 65160, options [mss 1460,sackOK,TS val 1055423829 ecr 4156713681,nop,wscale 7,mptcp capable v1 {0x9eec1592a7217a8}], length 0
17:14:39.208825 IP 10.1.1.1.33710 > 10.1.1.2.5201: Flags [.], ack 1, win 502, options [nop,nop,TS val 4156713681 ecr 1055423829,mptcp capable v1 {0x2cc8e25a5c6d217f,0x9eec1592a7217a8}], length 0
17:14:39.209519 IP 10.1.1.1.33710 > 10.1.1.2.5201: Flags [P.], seq 1:38, ack 1, win 502, options [nop,nop,TS val 4156713682 ecr 1055423829,mptcp capable v1 {0x2cc8e25a5c6d217f,0x9eec1592a7217a8},nop,nop], length 37
17:14:39.209601 IP 10.1.1.2.5201 > 10.1.1.1.33710: Flags [.], ack 38, win 509, options [nop,nop,TS val 1055423830 ecr 4156713682,mptcp dss ack 15089186376620249533], length 0
17:14:39.210653 IP 10.2.2.1.45143 > 10.1.1.2.5201: Flags [S], seq 160553466, win 64256, options [mss 1460,sackOK,TS val 806476640 ecr 0,nop,wscale 7,mptcp join id 1 token 0x49260942 nonce 0xde1d403b], length 0
17:14:39.211445 IP 10.2.2.2.60225 > 10.1.1.1.33710: Flags [S], seq 1520265331, win 65152, options [mss 1460,sackOK,TS val 1392569757 ecr 0,nop,wscale 7,mptcp join id 2 token 0xb0f82e5b nonce 0xa2cc8d43], length 0
17:14:39.213483 IP 10.2.2.1.45143 > 10.1.1.2.5201: Flags [.], ack 2993543056, win 502, options [nop,nop,TS val 806476642 ecr 1101702238,mptcp join hmac 0x363b5e1643ed79ffe4553683201dad342222bc62], length 0
17:14:39.224925 IP 10.2.2.1.50129 > 10.1.1.2.5201: Flags [.], ack 2, win 502, options [nop,nop,TS val 806476654 ecr 1101702251,mptcp dss ack 16737065810017587891], length 0
17:14:39.225378 IP 10.2.2.1.50129 > 10.1.1.2.5201: Flags [.], ack 3, win 502, options [nop,nop,TS val 806476655 ecr 1101702252,mptcp dss ack 16737065810017587892], length 0
17:14:39.229630 IP 10.1.1.1.33710 > 10.1.1.2.5201: Flags [P.], seq 38:7158, ack 1, win 502, options [nop,nop,TS val 4156713702 ecr 1055423830,mptcp dss ack 3409098701 seq 15089186376620249533 subseq 38 len 31328,nop,nop], length 7120
17:14:39.229851 IP 10.1.1.2.5201 > 10.1.1.1.33710: Flags [.], ack 7158, win 480, options [nop,nop,TS val 1055423850 ecr 4156713702,mptcp dss ack 15089186376620256653], length 0
17:14:39.230004 IP 10.1.1.1.33710 > 10.1.1.2.5201: Flags [P.], seq 7158:14278, ack 1, win 502, options [nop,nop,TS val 4156713702 ecr 1055423830,mptcp dss ack 3409098701 seq 15089186376620249533 subseq 38 len 31328,nop,nop], length 7120
17:14:39.230244 IP 10.1.1.2.5201 > 10.1.1.1.33710: Flags [.], ack 14278, win 447, options [nop,nop,TS val 1055423851 ecr 4156713702,mptcp dss ack 15089186376620263773], length 0
17:14:39.230398 IP 10.1.1.1.33710 > 10.1.1.2.5201: Flags [P.], seq 14278:24246, ack 1, win 502, options [nop,nop,TS val 4156713703 ecr 1055423850,mptcp dss ack 3409098701 seq 15089186376620249533 subseq 38 len 31328,nop,nop], length 9968
17:14:39.230467 IP 10.1.1.2.5201 > 10.1.1.1.33710: Flags [.], ack 24246, win 469, options [nop,nop,TS val 1055423851 ecr 4156713703,mptcp dss ack 15089186376620273741], length 0
17:14:39.230570 IP 10.1.1.1.33710 > 10.1.1.2.5201: Flags [P.], seq 24246:31366, ack 1, win 502, options [nop,nop,TS val 4156713703 ecr 1055423851,mptcp dss ack 3409098701 seq 15089186376620249533 subseq 38 len 31328,nop,nop], length 7120
17:14:39.230604 IP 10.1.1.2.5201 > 10.1.1.1.33710: Flags [.], ack 31366, win 480, options [nop,nop,TS val 1055423851 ecr 4156713703,mptcp dss ack 15089186376620280861], length 0
17:14:39.230646 IP 10.1.1.1.33710 > 10.1.1.2.5201: Flags [P.], seq 31366:32766, ack 1, win 502, options [nop,nop,TS val 4156713703 ecr 1055423851,mptcp dss ack 3409098701 seq 15089186376620280861 subseq 31366 len 1400,nop,nop], length 1400
17:14:39.230685 IP 10.1.1.2.5201 > 10.1.1.1.33710: Flags [.], ack 32766, win 501, options [nop,nop,TS val 1055423851 ecr 4156713703,mptcp dss ack 15089186376620282261], length 0
17:14:39.231251 IP 10.1.1.1.33710 > 10.1.1.2.5201: Flags [P.], seq 32766:55550, ack 1, win 502, options [nop,nop,TS val 4156713703 ecr 1055423851,mptcp dss ack 3409098701 seq 15089186376620282261 subseq 32766 len 31328,nop,nop], length 22784
17:14:39.231380 IP 10.1.1.2.5201 > 10.1.1.1.33710: Flags [.], ack 55550, win 418, options [nop,nop,TS val 1055423852 ecr 4156713703,mptcp dss ack 15089186376620305045], length 0
```

Thanks!

**Comment by pabeni** [comment]
please additionally report even the command used to run the server and the client.

**Comment by dmytroshytyi** [comment]
Please find the command used to run the server and client:

strace -o strace.serve -f  ip netns exec ns2 iperf3 -s -B 0.0.0.0 > /dev/null &

```
root@debian:~# cat strace.serve | grep socket
541   socket(AF_NETLINK, SOCK_RAW|SOCK_CLOEXEC, NETLINK_ROUTE) = 3
541   socket(AF_NETLINK, SOCK_RAW|SOCK_CLOEXEC, NETLINK_ROUTE) = 4
541   socket(AF_INET, SOCK_STREAM, IPPROTO_MPTCP) = 3
541   socket(AF_INET, SOCK_STREAM, IPPROTO_MPTCP) = 3
```
 strace -o strace.client -f ip netns exec ns1 iperf3 -c 10.1.1.2 -t 1 > /dev/null &
```
root@debian:~# cat strace.client | grep socket
515   socket(AF_NETLINK, SOCK_RAW|SOCK_CLOEXEC, NETLINK_ROUTE) = 3
515   socket(AF_NETLINK, SOCK_RAW|SOCK_CLOEXEC, NETLINK_ROUTE) = 4
515   socket(AF_INET, SOCK_STREAM, IPPROTO_MPTCP) = 4
515   socket(AF_INET, SOCK_STREAM, IPPROTO_MPTCP) = 5
```

**Comment by pabeni** [comment]
> ip netns exec ns1 ip mptcp endpoint add 10.1.1.1 singal

The above endpoint configuration is wrong (beyond the typo): ns1 is the 'client' namespace, a signal endpoint will work only in presence of a port (and will be quite an unusual setup)

> ip netns exec ns1 ip mptcp endpoint add 10.2.2.1 subflow
 
> ip netns exec ns2 ip mptcp endpoint add 10.1.1.2 subflow
> ip netns exec ns2 ip mptcp endpoint add 10.2.2.2 subflow

The above endpoints configuration is wrong: ns2 is the server namespace, the 'subflow' flags means the server will try to connect back to the client address/port (and will find a closed port)

> ip netns exec ns1 ip mptcp endpoint change id 1 fullmesh
> ip netns exec ns1 ip mptcp endpoint change id 2 fullmesh

it would be better/simpler to add all the endpoint flags with a single command, at least for valid endpoint

[...]

> [       SF_CLOSED] token=8b48782d remid=0 locid=2 saddr4=10.2.2.2 daddr4=10.1.1.1 sport=54459 dport=34172 backup=0 error=111

This is the server connecting back to the client, receiving a ECONNREFUSED error, as expected

> [  SF_ESTABLISHED] token=8b48782d remid=1 locid=0 saddr4=10.1.1.2 daddr4=10.2.2.1 sport=5201 dport=36341 backup=0
> ```
> 
> tcpdump packet trace:
> 
> ```
> root@debian:~# tcpdump -r tcpdump.out
> reading from file tcpdump.out, link-type EN10MB (Ethernet), snapshot length 262144

[...]

it looks like there has been some packet drop, as the pcap traces does not contain the TCP reset causing the ECONNREFUSED above.

**Comment by dmytroshytyi** [comment]
Thanks, @pabeni

**Comment by AlejandraOliver** [comment]
Hi @dmytroshytyi-6WIND, could you show the final tesbed setup that you use to simulate the virtual enviroment  in order to verify the correct behaviour of MPTCP?

Thanks in advance!!!

**Comment by matttbe** [comment]
@AlejandraOliver if you are interested in having a development environment for MPTCP, you can have a look at this: https://github.com/multipath-tcp/mptcp-upstream-virtme-docker

**Comment by AlejandraOliver** [comment]
I want to set up a real enviroment with two machines but not a virtual enviroment like it show in https://github.com/multipath-tcp/mptcp-upstream-virtme-docker

**Comment by dmytroshytyi** [comment]
@AlejandraOliver,
The setup I provided in the topic head is intended to be run on the same machine with using of linux namespaces. Moreover it seems it need some adjustments, when talking about additional subflow establishment, as you could find an expected error.

The next might help for creating a real environment with two machines:

- Latest Linux kernel compiled from sources.
- Verify that mptcp option is enabled in the .config before compilation.
- User-space application that is using mptcp socket. Or tools like mptcpize, strace(to verify that socket is mptcp)
- Test, that might help to describe the setup with namespaces (for each machine, delete the namespaces, adapt it a little bit and it might work as expected on separate machines) https://kernel.googlesource.com/pub/scm/linux/kernel/git/netdev/net-next/+/refs/tags/v6.3-rc6/tools/testing/selftests/net/mptcp/simult_flows.sh (Didn't test this)
- Finally path monitor and tcpdump/tsharp helps a lot to identify if connections are established as expected.

You might find many examples on the internet.

**Comment by AlejandraOliver** [comment]
I don't see any example of what commands I need to use to create the enviroment on the internet, or any example of a created scenario but thanks anyway, I will see.
