### ISSUE TITLE
MPTCP backup subflow compatibility

### ISSUE THREAD

**Issue by gwill66** [multipath-tcp/mptcp_net-next#553]
Hi,

I'm using MPTCP to create a connection between a device running Linux 5.15 and a laptop running Ubuntu.

The multipath connection was established and working ok when the laptop was running Ubuntu 22.04 but after upgrade to Ubuntu 24.04 I see that the backup flag is no longer set on the subflow created on the client device, but is set on the server laptop.

Device (A) is similar spec to a Pi4 running Linux 5.15 kernel - it has two interfaces and acts as the client.
Laptop (B) is running Ubuntu 24.04.1/6.8 kernel - it has one interface and acts as the server.

```
Main path:   Device A 5G (10.0.1.101)       ------> Laptop B (10.0.1.103)
Backup path: Device A Ethernet (10.0.1.102) ------> Laptop B (10.0.1.103)
```

Device (A) has one endpoint configured manually for a backup subflow:

```
ip mptcp endpoint add 10.0.1.102 dev wg2 subflow backup
```

Laptop (B) has no MPTCP endpoints configured.

On device A:

```
mptcpize run -d ncat 10.0.1.103 8001

ip mptcp mon
[       CREATED] token=4625f857 remid=0 locid=0 saddr4=10.0.1.101 daddr4=10.0.1.103 sport=59656 dport=8001
[   ESTABLISHED] token=4625f857 remid=0 locid=0 saddr4=10.0.1.101 daddr4=10.0.1.103 sport=59656 dport=8001
[SF_ESTABLISHED] token=4625f857 remid=0 locid=1 saddr4=10.0.1.102 daddr4=10.0.1.103 sport=55337 dport=8001 **backup=0** ifindex=14
```

On device B:

```
mptcpize run -d ncat -l -k 8000

ip mptcp mon
[       CREATED] token=2b7d8cfc remid=0 locid=0 saddr4=10.0.1.103 daddr4=10.0.1.101 sport=8001 dport=59656
[   ESTABLISHED] token=2b7d8cfc remid=0 locid=0 saddr4=10.0.1.103 daddr4=10.0.1.101 sport=8001 dport=59656
[SF_ESTABLISHED] token=2b7d8cfc remid=1 locid=0 saddr4=10.0.1.103 daddr4=10.0.1.102 sport=8001 dport=55337 backup=1
```

tcpdump:

```
15:04:47.382215 IP 10.0.1.101.59656 > 10.0.1.103.8001: Flags [S], seq 3805323982, win 64896, options [mss 1352,sackOK,TS val 2621358929 ecr 0,nop,wscale 6,mptcp 4 capable v1], length 0
15:04:47.382341 IP 10.0.1.103.8001 > 10.0.1.101.59656: Flags [S.], seq 2760295503, ack 3805323983, win 64296, options [mss 1380,sackOK,TS val 2003624784 ecr 2621358929,nop,wscale 7,mptcp 12 capable v1 {0xaf2dab2e724eea33}], length 0
15:04:47.442257 IP 10.0.1.101.59656 > 10.0.1.103.8001: Flags [.], ack 1, win 1014, options [nop,nop,TS val 2621359030 ecr 2003624784,mptcp 20 capable v1 {0xa82df1826aea1ce0,0xaf2dab2e724eea33}], length 0
15:04:50.863936 IP 10.0.1.101.59656 > 10.0.1.103.8001: Flags [P.], seq 1:5, ack 1, win 1014, options [nop,nop,TS val 2621362382 ecr 2003624784,mptcp 22 capable v1 {0xa82df1826aea1ce0,0xaf2dab2e724eea33},nop,nop], length 4
15:04:50.864006 IP 10.0.1.103.8001 > 10.0.1.101.59656: Flags [.], ack 5, win 503, options [nop,nop,TS val 2003628265 ecr 2621362382,mptcp 12 dss ack 12555401669475721760], length 0
15:04:52.194369 IP 10.0.1.102.55337 > 10.0.1.103.8001: Flags [S], seq 223639290, win 64896, options [mss 1352,sackOK,TS val 1335606531 ecr 0,nop,wscale 6,mptcp 12 join backup id 1 token 0x2b7d8cfc nonce 0x4c68fbf0], length 0
15:04:52.194426 IP 10.0.1.103.8001 > 10.0.1.102.55337: Flags [S.], seq 875372153, ack 223639291, win 64296, options [mss 1380,sackOK,TS val 1504287791 ecr 1335606531,nop,wscale 7,mptcp 16 join id 0 hmac 0xa2606065fc25ef0a nonce 0xb6dcf183], length 0
15:04:52.252248 IP 10.0.1.102.55337 > 10.0.1.103.8001: Flags [.], ack 1, win 1014, options [nop,nop,TS val 1335606640 ecr 1504287791,mptcp 24 join hmac 0x662e0c888d6a3012d8381bb44a1d12f47e652f75], length 0
15:04:52.252328 IP 10.0.1.103.8001 > 10.0.1.102.55337: Flags [.], ack 1, win 503, options [nop,nop,TS val 1504287849 ecr 1335606640,mptcp 12 dss ack 12555401669475721760], length 0
```

The backup flag is set in the MP_JOIN from the client but isn't set in the response from the server.
Tests show the transmit traffic from device A is being shared across the two interfaces, its not being used as a backup subflow.

* Device (5.15) -> Laptop with 5.15 or 6.1 kernel - working ok.
* Device (5.15) -> Laptop with 6.8 or 6.11 kernel - does not set the backup flag.

I seen there have been some changes around the backup flags that may be related.

Is there a compatibility issue or a way to configure this setup?

**Comment by matttbe** [comment]
Hello,

Thank you for this bug report with all the details.

> Device (5.15) -> Laptop with 5.15 or 6.1 kernel - working ok.

Which exact kernel version are you using?

> I seen there have been some changes around the backup flags that may be related.

Indeed, there were some issues, see this series [here](https://lore.kernel.org/mptcp/20240727-upstream-net-20240727-mptcp-backup-signal-v1-0-f50b31604cf1@kernel.org/). Backports to stable have been done in August 2024, they should be in v5.10.224, v5.15.165, v6.1.104 and v6.6.45. In short, on old kernels:
- the server was wrongly mirroring the backup flag from the SYN to the SYN+ACK
- the packet scheduler was only looking at the backup flag set by the other peer

At the end, in most cases, that was fine: when the client was setting the backup flag, the server (running Linux) was doing the same, and the client was respecting the backup flag when sending data because the server accidentally set the backup flag as well. But that was wrong.

If your client's kernel doesn't the fixes from last July / August, but your server does, then yes, the client will not respect the backup flag it set before, because the server now correctly stop mirroring the backup flag.

Can you then update the client's kernel?

**Comment by gwill66** [comment]
Thanks for the reply, we are currently using 5.15.24 provided in an SDK, so not easy to change. I will check if its possible to move to one if the backport versions.

**Comment by matttbe** [comment]
Even if I do recommend to switch to the latest v5.15 (or newer) stable version, you can also try to backport some specific patches, e.g. just [this one](https://web.git.kernel.org/pub/scm/linux/kernel/git/stable/linux.git/commit/?id=42c7f7ac9ac3269bd250e1476b0d9c90e356cc50)

**Comment by gwill66** [comment]
Ok - we will have to move to compatible kernel versions or backport the patch.

**Comment by matttbe** [comment]
I suggest closing this ticket. Please re-open it if you still have issues with the newer version or after the backport.
