### ISSUE TITLE
Reset on subflow

### ISSUE THREAD

**Issue by cschoene7600** [multipath-tcp/mptcp_net-next#630]
### Pre-requisites

- [x] A similar [question](https://github.com/multipath-tcp/mptcp_net-next/issues?q=label%3question) has not been reported before.
- [x] [mptcp.dev](https://www.mptcp.dev) website does not cover my case.
- [x] The [wiki](https://github.com/multipath-tcp/mptcp_net-next/wiki) doesn't cover my case.
- [ ] This is not a question related to the current behavior, an issue or a feature requst: if it is, please use [another template](https://github.com/multipath-tcp/mptcp_net-next/issues/new/choose) **even if it is a question**: we will need details about your system: kernel version, config, etc.

### My question

Hi,
I can't get MPTCP to work because the server is always rejecting a second subflow. I tried many scenarios but come back to this problem.
If this is the wrong place, please let me know. I just got started with this.

My setup is this:
2 machines, Debian 13 (tested with Linux 6.12 and 7.1)
Both have 2 network interfaces. These 2 ip networks are seperated and not connected. One should work as backup, basically. No router involved.

Server
```
net a: 10.110.158.201
net b: 192.168.1.201
ip mptcp endpoint add 10.110.158.201 dev ens18 signal
ip mptcp endpoint add 192.168.1.201 dev ens19 signal
ip mptcp limits set subflows 4 add_addr_accepted 4
```

Client
```
net a: 10.110.158.202
net b: 192.168.1.202
ip mptcp endpoint add 10.110.158.202 dev ens18 subflow fullmesh
ip mptcp endpoint add 192.168.1.202 dev ens19 subflow fullmesh
ip mptcp limits set subflows 4 add_addr_accepted 4
```

For testing I used netcat with mptcpize like this:
```
mptcpize run nc -l -p 5000 > /dev/null
```

Problem:
I do see both sides talking MPTCP. The server is sending it's second IP to the client. The client is connecting. However, it is getting a RST from the server.
I don't know the reason for it. I also don't know where else to look for it.

This is what I captured:

```
No.     Time           Source                Destination           Protocol Length Info
      8 0.001243       192.168.1.201         192.168.1.202         MPTCP    88     [TCP Dup ACK 7#1] 5000 → 50582 [ACK] Seq=1 Ack=8193 Win=63488 Len=0 TSval=2826742249 TSecr=2995278264
    Options: (28 bytes), No-Operation (NOP), No-Operation (NOP), Timestamps, MPTCP
        TCP Option - No-Operation (NOP)
        TCP Option - No-Operation (NOP)
        TCP Option - Timestamps: TSval 2826742249, TSecr 2995278264
        Multipath Transmission Control Protocol: Add Address
            Kind: Multipath TCP (30)
            Length: 16
            0011 .... = Multipath TCP subtype: Add Address (3)
            .... ...0 = Echo: 0
            Address ID: 1
            Advertised IPv4 Address: 10.110.158.201
            Truncated HMAC: 15248364568178953128
    [Timestamps]
    [SEQ/ACK analysis]
    [MPTCP analysis]

No.     Time           Source                Destination           Protocol Length Info
     11 0.001694       10.110.158.202        10.110.158.201        MPTCP    92     34461 → 5000 [SYN] Seq=0 Win=64240 Len=0 MSS=1460 SACK_PERM TSval=4182431163 TSecr=0 WS=1024
    Options: (32 bytes), Maximum segment size, SACK permitted, Timestamps, No-Operation (NOP), Window scale, MPTCP
        TCP Option - Maximum segment size: 1460 bytes
        TCP Option - SACK permitted
        TCP Option - Timestamps: TSval 4182431163, TSecr 0
        TCP Option - No-Operation (NOP)
        TCP Option - Window scale: 10 (multiply by 1024)
        Multipath Transmission Control Protocol: Join Connection
            Kind: Multipath TCP (30)
            Length: 12
            0001 .... = Multipath TCP subtype: Join Connection (1)
            Multipath TCP flags: 0x10
                .... ...0 = Backup flag: 0
            Address ID: 1
            Receiver's Token: 3530892172
            Sender's Random Number: 4243325074
    [Timestamps]
    [MPTCP analysis]

No.     Time           Source                Destination           Protocol Length Info
     12 0.001734       10.110.158.201        10.110.158.202        TCP      60     5000 → 34461 [RST, ACK] Seq=1 Ack=1 Win=0 Len=0
Frame 12: 60 bytes on wire (480 bits), 60 bytes captured (480 bits)
Linux cooked capture v2
Internet Protocol Version 4, Src: 10.110.158.201, Dst: 10.110.158.202
Transmission Control Protocol, Src Port: 5000, Dst Port: 34461, Seq: 1, Ack: 1, Len: 0
    Source Port: 5000
    Destination Port: 34461
    [Stream index: 1]
    [Stream Packet Number: 2]
    [Conversation completeness: Incomplete (37)]
    [TCP Segment Len: 0]
    Sequence Number: 1    (relative sequence number)
    Sequence Number (raw): 0
    [Next Sequence Number: 1    (relative sequence number)]
    Acknowledgment Number: 1    (relative ack number)
    Acknowledgment number (raw): 3627298642
    0101 .... = Header Length: 20 bytes (5)
    Flags: 0x014 (RST, ACK)
    Window: 0
    [Calculated window size: 0]
    [Window size scaling factor: -1 (unknown)]
    Checksum: 0xbbb4 [unverified]
    [Checksum Status: Unverified]
    Urgent Pointer: 0
    [Timestamps]
    [SEQ/ACK analysis]
```

ip mptcp monitor just shows this:
SF_CLOSED] ... error=111

**Comment by matttbe** [comment]
Hello,

> ```
> mptcpize run nc -l -p 5000 > /dev/null
> ```

If I remember well, `nc -l` will only allow one connection and close the listening socket when connected. In other words, the kernel will stop accepting connections requests (SYN) including MPTCP Join requests (new subflows)

Can you try with `nc -l -k` or another tool?

**Comment by cschoene7600** [comment]
Whow, you are right! Thank you!

Netcat with -k works.

I didn't expect that behavior. I thought this is transparent to the application.

**Comment by matttbe** [comment]
> I didn't expect that behavior. I thought this is transparent to the application.

I understand the confusion, but the thing is that MPTCP relies on the listening socket to accept new subflows. But that's OK because Netcat's behaviour is unusual.

I'm not sure what we can do to help in this case. Maybe mentioning this case in the [FAQ](https://www.mptcp.dev/faq.html)?

**Comment by cschoene7600** [comment]
Yes, maybe. I guess many people would use netcat first when playing with it.

**Comment by matttbe** [comment]
> Yes, maybe. I guess many people would use netcat first when playing with it.

Something like that? https://github.com/multipath-tcp/mptcp.dev/pull/82

**Comment by cschoene7600** [comment]
Very nice, looks good to me.
