### ISSUE TITLE
[selftests] `mptcp_connect.sh`: `copyfd_io_poll`: poll timed out

### ISSUE THREAD

**Issue by matttbe** [multipath-tcp/mptcp_net-next#574]
I don't think it happened on our CI (I still need to double-check), but NIPA can "easily" hit such issue:

```
# 49 ns1 MPTCP -> ns1 (dead:beef:1::1:10046) TCP       (duration    36ms) [ OK ]
# 50 ns1 TCP   -> ns1 (dead:beef:1::1:10047) MPTCP     copyfd_io_poll: poll timed out (events: POLLIN 1, POLLOUT 0)
# (duration 30279ms) [FAIL] file received by server does not match (in, out):
# -rw------- 1 root root 5171914 Jul 16 05:24 /tmp/tmp.W2c96hxSIz
# Trailing bytes are: 
# w,ѐ)-rw------- 1 root root 5166208 Jul 16 05:24 /tmp/tmp.s33PNcrN6M
# Trailing bytes are: 
# (<v /&^<ֱrnFsaC7INFO: with peek mode: saveAfterPeek
```

[logs](https://netdev-3.bots.linux.dev/vmksft-mptcp/results/211121/4-mptcp-connect-sh/stdout)
[history](https://netdev.bots.linux.dev/flakes.html?tn-needle=mptcp&br-pfx=net-next)

BTW, as Jakub suggested, we should probably print a hexdump instead of random data :)

**Comment by matttbe** [comment]
If someone is able to have a look, don't hesitate. A first step is certainly to try reproducing this issue to better understand the root cause, e.g. using `stress-ng` in parallel or in the VM, changing the sched priorities for the VM, etc.

**Comment by matttbe** [comment]
Note: the regressions **might** be more frequent due to this [series](https://lore.kernel.org/all/20250711114006.480026-1-edumazet@google.com/).

See the discussion [here](https://lore.kernel.org/all/20250717074242.1ef5d441@kernel.org/)

**Comment by pabeni** [comment]
All the recent upstream failures happen in TCP -> MPTCP fallback case; i.e. when both the client and the server are really plain TCP sockets. (That sort of hint a plain TCP issue). 

In all of the failures with MIB availables - most of the total failures, but not all of them - there something alike:

```
# TcpExtBeyondWindow              7                  0.0
# TcpExtTCPFromZeroWindowAdv      29                 0.0
# TcpExtTCPToZeroWindowAdv        28                 0.0
```

That is: non zero TcpExtBeyondWindow and TcpExtTCPFromZeroWindowAdv  > TcpExtTCPToZeroWindowAdv. I *suspect* the check introduced by upstream commit 9ca48d616ed76b284f946667a3cb7961205c8ee3 could be too restrictive, but I can't reproduce the issue locally so far.

**Comment by pabeni** [comment]
> `# TcpExtBeyondWindow 7 0.0`

This is some misleading info from the kernel. Such MIB is incremented even when zero window probe is received (which does not use a seq beyond window, but an "old" one). Possibly some tcp fixlet would be needed.

I can finally reproduce the issue (with modified mptcp_connect.sh in a loop, doing only the tcp -> mptcp fallback test-cases, on a non debug kernel).

The receiver got stuck with a 0 window and a 0 receive buf (this looks like a tcp bug).

**Comment by pabeni** [comment]
> The receiver got stuck with a 0 window and a 0 receive buf (this looks like a tcp bug).

Patches shared on netdev:

https://lore.kernel.org/netdev/cover.1752859383.git.pabeni@redhat.com/T/#u

**Comment by matttbe** [comment]
@pabeni thank you for having taken the time to investigate and fix that!

I just added these patches in our tree (fixes for net-next), so our CI also has these fixes.

New patches for t/upstream:
- ebfd9a78da4b: tcp: do not set a zero size receive buffer
- 038166f66b80: tcp: do not increment BeyondWindow MIB for old seq
- Results: de29714b04e4..132bb933cdf0 (export)

Tests are now in progress:

- export: https://github.com/multipath-tcp/mptcp_net-next/commit/d32ad82dc6d5b162c86b738279bd72f10a943e8e/checks

I guess we can close this ticket then!

**Comment by matttbe** [comment]
It looks like we still have instabilities on [NIPA's side](https://netdev.bots.linux.dev/flakes.html?tn-needle=mptcp&br-pfx=net-next) and [our side](https://ci-results.mptcp.dev/flakes.html) with the `disconnect`, e.g.:

```
03 ns1 TCP   -> ns1 (10.0.1.1:10002      ) MPTCP     Unexpected revents: POLLERR/POLLNVAL(19) 
(duration   883ms) [FAIL] file received by server does not match (in, out):
```

I quickly checked (while travelling) and in some failures, I can see RST being sent (no FIN), but for a TCP → MPTCP connection, so in plain TCP:

```
16:40:06.410118 lo    In  IP 10.0.1.1.40048 > 10.0.1.1.10002: Flags [P.], seq 7465985:7517697, ack 8251532, win 429, options [nop,nop,TS val 3861855598 ecr 3861855598], length 51712
16:40:06.410127 lo    In  IP 10.0.1.1.10002 > 10.0.1.1.40048: Flags [.], ack 7517697, win 0, options [nop,nop,TS val 3861855598 ecr 3861855598], length 0
16:40:06.411295 lo    In  IP 10.0.1.1.10002 > 10.0.1.1.40048: Flags [.], ack 7517697, win 202, options [nop,nop,TS val 3861855599 ecr 3861855598], length 0
16:40:06.411335 lo    In  IP 10.0.1.1.40048 > 10.0.1.1.10002: Flags [P.], seq 7517697:7569409, ack 8251532, win 429, options [nop,nop,TS val 3861855599 ecr 3861855599], length 51712
16:40:06.411346 lo    In  IP 10.0.1.1.10002 > 10.0.1.1.40048: Flags [.], ack 7569409, win 0, options [nop,nop,TS val 3861855599 ecr 3861855599], length 0
16:40:06.411470 lo    In  IP 10.0.1.1.40048 > 10.0.1.1.10002: Flags [R.], seq 7569409, ack 8251532, win 429, options [nop,nop,TS val 3861855599 ecr 3861855599], length 0
16:40:06.411510 lo    In  IP 10.0.1.1.40054 > 10.0.1.1.10002: Flags [S], seq 2370505078, win 65495, options [mss 65495,sackOK,TS val 3861855600 ecr 0,nop,wscale 8], length 0
16:40:06.411522 lo    In  IP 10.0.1.1.10002 > 10.0.1.1.40054: Flags [S.], seq 216324373, ack 2370505079, win 65483, options [mss 65495,sackOK,TS val 3861855600 ecr 3861855600,nop,wscale 8], length 0
16:40:06.411541 lo    In  IP 10.0.1.1.40054 > 10.0.1.1.10002: Flags [.], ack 1, win 256, options [nop,nop,TS val 3861855600 ecr 3861855600], length 0
```

It looks similar to what @pabeni saw, no?

I suggest re-opening this ticket for the moment, even if it is not exactly the same.

**Comment by matttbe** [comment]
> It looks like we still have instabilities on [NIPA's side](https://netdev.bots.linux.dev/flakes.html?tn-needle=mptcp&br-pfx=net-next) and [our side](https://ci-results.mptcp.dev/flakes.html) with the `disconnect`, e.g.:
> 
> ```
> 03 ns1 TCP   -> ns1 (10.0.1.1:10002      ) MPTCP     Unexpected revents: POLLERR/POLLNVAL(19) 
> (duration   883ms) [FAIL] file received by server does not match (in, out):
> ```

This issue with the `disconnect` cases and the `Unexpected revents: POLLERR/POLLNVAL(19)` error have been fixed by [this series](https://lore.kernel.org/mptcp/20250910-sft-mptcp-disc-err-v3-0-6799fa467d77@kernel.org/).

Back to the `copyfd_io_poll: poll timed out` one, the [CI just hit it again](https://github.com/multipath-tcp/mptcp_net-next/actions/runs/17669503636) :'( (when testing `export-net`):

```
# INFO: with MPTFO start
# 57 ns2 MPTCP -> ns1 (10.0.1.1:10054      ) MPTCP     (duration   962ms) [ OK ]
# 58 ns2 MPTCP -> ns1 (10.0.1.1:10055      ) MPTCP     copyfd_io_poll: poll timed out (events: POLLIN 0, POLLOUT 4)
# copyfd_io_poll: poll timed out (events: POLLIN 1, POLLOUT 0)
# (duration 32559ms) [FAIL] client exit code 2, server 2
# 
# netns ns1-kHaxNs (listener) socket stat for 10055:
# Failed to find cgroup2 mount
# Failed to find cgroup2 mount
# Failed to find cgroup2 mount
# Netid State    Recv-Q Send-Q Local Address:Port  Peer Address:Port                                                                                                                                                                                                                                                                                                                                                                                                                                                                                                                                                                                                                                                                                                                                                                                                                                                                                         
# tcp   ESTAB    0      184920      10.0.1.1:10055     10.0.1.2:37004 timer:(on,21sec,7) ino:34480 sk:20b9 cgroup:unreachable:1 <->
# 	 skmem:(r0,rb131072,t0,tb350208,f424,w192088,o0,bl0,d0) ts sack fastopen cubic wscale:10,10 rto:25728 backoff:7 rtt:0.615/0.209 ato:40 mss:1448 pmtu:1500 rcvmss:1448 advmss:1448 cwnd:1 ssthresh:3 bytes_sent:4267996 bytes_retrans:562808 bytes_acked:3698088 bytes_received:354075 segs_out:3071 segs_in:726 data_segs_out:3042 data_segs_in:265 send 18835772bps lastsnd:4249 lastrcv:32881 lastack:4249 pacing_rate 112968704bps delivery_rate 62548592bps delivered:2636 busy:32902ms rwnd_limited:3ms(0.0%) unacked:5 retrans:1/402 lost:5 reordering:6 reord_seen:1 rcv_rtt:1 rcv_space:14600 rcv_ssthresh:114450 notsent:177820 minrtt:0.132 snd_wnd:120832 rcv_wnd:114688 rehash:16 tcp-ulp-mptcp flags:Mec token:0000(id:0)/392c17f9(id:0) seq:8690475767129746238 sfseq:350837 ssnoff:2754628129 maplen:1819
# mptcp LAST-ACK 0      0           10.0.1.1:10055     10.0.1.2:37004 timer:(keepalive,59sec,0) ino:0 sk:20ba cgroup:unreachable:1 ---
# 	 skmem:(r0,rb131072,t0,tb354304,f2416,w243344,o0,bl0,d0) subflows_max:2 remote_key token:392c17f9 write_seq:7261196540842669504 snd_una:7261196540842427783 rcv_nxt:8690475767129748058 csum_enabled:1 bytes_sent:3883008 bytes_received:354075 bytes_acked:3641288 subflows_total:1 last_data_sent:30724 last_data_recv:32888 last_ack_recv:4256                                                                                                                                                                                                                                                                                                                                                                                                                                                                    
# TcpPassiveOpens                 1                  0.0
# TcpInSegs                       530                0.0
# TcpOutSegs                      2670               0.0
# TcpRetransSegs                  402                0.0
# TcpExtTCPPureAcks               406                0.0
# TcpExtTCPSackRecovery           10                 0.0
# TcpExtTCPSACKReorder            1                  0.0
# TcpExtTCPLostRetransmit         6                  0.0
# TcpExtTCPFastRetrans            189                0.0
# TcpExtTCPSlowStartRetrans       197                0.0
# TcpExtTCPTimeouts               16                 0.0
# TcpExtTCPLossProbes             18                 0.0
# TcpExtTCPBacklogCoalesce        53                 0.0
# TcpExtTCPSackMerged             9                  0.0
# TcpExtTCPSackShiftFallback      26                 0.0
# TcpExtTCPFastOpenActiveFail     1                  0.0
# TcpExtTCPFastOpenPassive        1                  0.0
# TcpExtTCPAutoCorking            9                  0.0
# TcpExtTCPOrigDataSent           2640               0.0
# TcpExtTCPHystartTrainDetect     1                  0.0
# TcpExtTCPHystartTrainCwnd       76                 0.0
# TcpExtTCPDelivered              2635               0.0
# TcpExtTcpTimeoutRehash          16                 0.0
# MPTcpExtMPCapableSYNRX          1                  0.0
# MPTcpExtMPCapableACKRX          1                  0.0
# MPTcpExtSndWndShared            138                0.0
# MPTcpExtRcvWndShared            1                  0.0
# 
# netns ns2-72y3ko (connector) socket stat for 10055:
# Failed to find cgroup2 mount
# Failed to find cgroup2 mount
# Failed to find cgroup2 mount
# Netid State      Recv-Q Send-Q Local Address:Port  Peer Address:Port                                                                                                                                                                                                                                                                                                                                                                                                                                                                                                                                                                                                                                                                                                                                            
# tcp   ESTAB      56800  0           10.0.1.2:37004     10.0.1.1:10055 ino:32665 sk:20bb cgroup:unreachable:1 <->
# 	 skmem:(r65108,rb65108,t0,tb46080,f428,w0,o0,bl0,d407) ts sack fastopen cubic wscale:10,10 rto:201 rtt:0.44/0.217 ato:40 mss:1448 pmtu:1500 rcvmss:1420 advmss:1448 cwnd:32 ssthresh:32 bytes_sent:354075 bytes_acked:354076 bytes_received:3698088 segs_out:726 segs_in:3072 data_segs_out:265 data_segs_in:3042 send 842472727bps lastsnd:33190 lastrcv:31021 lastack:990 pacing_rate 1010967272bps delivery_rate 97755272bps delivered:265 busy:35ms rcv_rtt:1 rcv_space:14480 rcv_ssthresh:120197 minrtt:0.114 rcv_ooopack:62 snd_wnd:114688 rcv_wnd:120832 tcp-ulp-mptcp flags:Mmecv token:0000(id:0)/e7d3c23c(id:0) seq:7261196540842427783 sfseq:3641289 ssnoff:1125274337 maplen:59640
# mptcp FIN-WAIT-2 0      0           10.0.1.2:37004     10.0.1.1:10055 timer:(keepalive,59sec,0) ino:0 sk:20bc cgroup:unreachable:1 ---
# 	 skmem:(r0,rb140978,t0,tb50176,f0,w0,o0,bl0,d0) subflows_max:2 remote_key token:e7d3c23c write_seq:8690475767129748058 snd_una:8690475767129748058 rcv_nxt:7261196540842427783 csum_enabled:1 bytes_sent:352655 bytes_received:3641288 bytes_acked:352656 subflows_total:1 last_data_sent:33197 last_data_recv:31038 last_ack_recv:997                                                                                                                                                                                                                                                                                                                                  
# TcpActiveOpens                  1                  0.0
# TcpInSegs                       758                0.0
# TcpOutSegs                      726                0.0
# TcpExtPruneCalled               61                 0.0
# TcpExtRcvPruned                 61                 0.0
# TcpExtBeyondWindow              32                 0.0
# TcpExtDelayedACKs               1                  0.0
# TcpExtTCPPureAcks               29                 0.0
# TcpExtTCPRcvCollapsed           45                 0.0
# TcpExtTCPRcvCoalesce            291                0.0
# TcpExtTCPOFOQueue               32                 0.0
# TcpExtTCPOFODrop                38                 0.0
# TcpExtTCPFastOpenActive         1                  0.0
# TcpExtTCPWantZeroWindowAdv      58                 0.0
# TcpExtTCPOrigDataSent           265                0.0
# TcpExtTCPHystartTrainDetect     1                  0.0
# TcpExtTCPHystartTrainCwnd       32                 0.0
# TcpExtTCPDelivered              266                0.0
# TcpExtTCPRcvQDrop               23                 0.0
# MPTcpExtMPCapableSYNTX          1                  0.0
# MPTcpExtMPCapableSYNACKRX       1                  0.0
# MPTcpExtRcvWndShared            191                0.0
# 
# 59 ns2 MPTCP -> ns1 (dead:beef:1::1:10056) MPTCP     (duration   989ms) [ OK ]
# 60 ns2 MPTCP -> ns1 (dead:beef:1::1:10057) MPTCP     (duration  1331ms) [ OK ]
# INFO: with MPTFO end
# [FAIL] Tests with MPTFO have failed
```

It looks like the connection didn't get close: DATA_FIN + ACK have not been received.

--------------------

Followed by a `main_loop_s: timed out` error :'(

```
# INFO: disconnect
# 63 ns1 MPTCP -> ns1 (10.0.1.1:20001      ) MPTCP     main_loop_s: timed out
# can't reconnect: 111(duration 31481ms) [FAIL] client exit code 1, server 2
# 
# netns ns1-kHaxNs (listener) socket stat for 20001:
# Netid State Recv-Q Send-Q Local Address:Port Peer Address:Port
# TcpActiveOpens                  2                  0.0
# TcpPassiveOpens                 1                  0.0
# TcpAttemptFails                 1                  0.0
# TcpEstabResets                  1                  0.0
# TcpInSegs                       62                 0.0
# TcpOutSegs                      63                 0.0
# TcpOutRsts                      3                  0.0
# TcpExtTW                        1                  0.0
# TcpExtDelayedACKs               1                  0.0
# TcpExtTCPPureAcks               16                 0.0
# TcpExtTCPWantZeroWindowAdv      3                  0.0
# TcpExtTCPOrigDataSent           41                 0.0
# TcpExtTCPDelivered              42                 0.0
# MPTcpExtMPCapableSYNRX          1                  0.0
# MPTcpExtMPCapableSYNTX          2                  0.0
# MPTcpExtMPCapableSYNACKRX       1                  0.0
# MPTcpExtMPCapableACKRX          1                  0.0
# MPTcpExtMPTCPRetrans            1                  0.0
# MPTcpExtDuplicateData           1                  0.0
# MPTcpExtMPFastcloseTx           1                  0.0
# MPTcpExtMPRstTx                 1                  0.0
# MPTcpExtRcvWndShared            2                  0.0
# 
# netns ns1-kHaxNs (connector) socket stat for 20001:
# Netid State     Recv-Q Send-Q Local Address:Port  Peer Address:Port 
# tcp   TIME-WAIT 0      0           10.0.1.1:35450     10.0.1.1:20001 timer:(timewait,28sec,0) ino:0 sk:20bd
# 	
# 
# 64 ns1 MPTCP -> ns1 (dead:beef:1::1:20002) MPTCP     (duration   851ms) [ OK ]
# 65 ns1 MPTCP -> ns1 (dead:beef:1::1:20003) TCP       (duration  1018ms) [ OK ]
# 66 ns1 TCP   -> ns1 (dead:beef:1::1:20004) MPTCP     (duration   835ms) [ OK ]
# [FAIL] Tests of the full disconnection have failed
```

It is not clear why one subflow is still in `TIME-WAIT`. Should we ignore them?

**Comment by pabeni** [comment]
> Back to the `copyfd_io_poll: poll timed out` one, the [CI just hit it again](https://github.com/multipath-tcp/mptcp_net-next/actions/runs/17669503636) :'( (when testing `export-net`):

There are many strange suspicious data point here...

> ```
> # INFO: with MPTFO start
> # 57 ns2 MPTCP -> ns1 (10.0.1.1:10054      ) MPTCP     (duration   962ms) [ OK ]
> # 58 ns2 MPTCP -> ns1 (10.0.1.1:10055      ) MPTCP     copyfd_io_poll: poll timed out (events: POLLIN 0, POLLOUT 4)
> # copyfd_io_poll: poll timed out (events: POLLIN 1, POLLOUT 0)
> # (duration 32559ms) [FAIL] client exit code 2, server 2
> # 
> # netns ns1-kHaxNs (listener) socket stat for 10055:
> # Failed to find cgroup2 mount
> # Failed to find cgroup2 mount
> # Failed to find cgroup2 mount
> # Netid State    Recv-Q Send-Q Local Address:Port  Peer Address:Port                                                                                                                                                                                                                                                                                                                                                                                                                                                                                                                                                                                                                                                                                                                                                                                                                                                                                         
> # tcp   ESTAB    0      184920      10.0.1.1:10055     10.0.1.2:37004 timer:(on,21sec,7) ino:34480 sk:20b9 cgroup:unreachable:1 <->
> # 	 skmem:(r0,rb131072,t0,tb350208,f424,w192088,o0,bl0,d0) ts sack fastopen cubic wscale:10,10 rto:25728 backoff:7 rtt:0.615/0.209 ato:40 mss:1448 pmtu:1500 rcvmss:1448 advmss:1448 cwnd:1 ssthresh:3 bytes_sent:4267996 bytes_retrans:562808 bytes_acked:3698088 bytes_received:354075 segs_out:3071 segs_in:726 data_segs_out:3042 data_segs_in:265 send 18835772bps lastsnd:4249 lastrcv:32881 lastack:4249 pacing_rate 112968704bps delivery_rate 62548592bps delivered:2636 busy:32902ms rwnd_limited:3ms(0.0%) unacked:5 retrans:1/402 lost:5 reordering:6 reord_seen:1 rcv_rtt:1 rcv_space:14600 rcv_ssthresh:114450 notsent:177820 minrtt:0.132 snd_wnd:120832 rcv_wnd:114688 rehash:16 tcp-ulp-mptcp flags:Mec token:0000(id:0)/392c17f9(id:0) seq:8690475767129746238 sfseq:350837 ssnoff:2754628129 maplen:1819
> # mptcp LAST-ACK 0      0           10.0.1.1:10055     10.0.1.2:37004 timer:(keepalive,59sec,0) ino:0 sk:20ba cgroup:unreachable:1 ---
> # 	 skmem:(r0,rb131072,t0,tb354304,f2416,w243344,o0,bl0,d0) subflows_max:2 remote_key token:392c17f9 write_seq:7261196540842669504 snd_una:7261196540842427783 rcv_nxt:8690475767129748058 csum_enabled:1 bytes_sent:3883008 bytes_received:354075 bytes_acked:3641288 subflows_total:1 last_data_sent:30724 last_data_recv:32888 last_ack_recv:4256                                                                                                                                                                                                                                                                                                                                                                                                                                                                    
> # TcpPassiveOpens                 1                  0.0
> # TcpInSegs                       530                0.0
> # TcpOutSegs                      2670               0.0
> # TcpRetransSegs                  402                0.0
> # TcpExtTCPPureAcks               406                0.0
> # TcpExtTCPSackRecovery           10                 0.0
> # TcpExtTCPSACKReorder            1                  0.0
> # TcpExtTCPLostRetransmit         6                  0.0
> # TcpExtTCPFastRetrans            189                0.0
> ```

A lot of TCP level retransmissions, unexpected.

> ```
> # tcp   ESTAB      56800  0           10.0.1.2:37004     10.0.1.1:10055 ino:32665 sk:20bb cgroup:unreachable:1 <->
> # 	 skmem:(r65108,rb65108,t0,tb46080,f428,w0,o0,bl0,d407) ts sack fastopen cubic wscale:10,10 rto:201 rtt:0.44/0.217 ato:40 mss:1448 pmtu:1500 rcvmss:1420 advmss:1448 cwnd:32 ssthresh:32 bytes_sent:354075 bytes_acked:354076 bytes_received:3698088 segs_out:726 segs_in:3072 data_segs_out:265 data_segs_in:3042 send 842472727bps lastsnd:33190 lastrcv:31021 lastack:990 pacing_rate 1010967272bps delivery_rate 97755272bps delivered:265 busy:35ms rcv_rtt:1 rcv_space:14480 rcv_ssthresh:120197 minrtt:0.114 rcv_ooopack:62 snd_wnd:114688 rcv_wnd:120832 tcp-ulp-mptcp flags:Mmecv token:0000(id:0)/e7d3c23c(id:0) seq:7261196540842427783 sfseq:3641289 ssnoff:1125274337 maplen:59640
> # mptcp FIN-WAIT-2 0      0           10.0.1.2:37004     10.0.1.1:10055 timer:(keepalive,59sec,0) ino:0 sk:20bc cgroup:unreachable:1 ---
> # 	 skmem:(r0,rb140978,t0,tb50176,f0,w0,o0,bl0,d0) subflows_max:2 remote_key token:e7d3c23c write_seq:8690475767129748058 snd_una:8690475767129748058 rcv_nxt:7261196540842427783 csum_enabled:1 bytes_sent:352655 bytes_received:3641288 bytes_acked:352656 subflows_total:1 last_data_sent:33197 last_data_recv:31038 last_ack_recv:997                                                                                                                                                                                                                                                                                                                                  
> ```

The TCP level rcv buff (~64K) is considerably smaller than the msk level one (140K) which is somewhat unexpected. TCP can shrink the RCV buffer when hitting memory limits && !tcp_can_ingest(skb).

> ```
> # TcpExtPruneCalled               61                 0.0
> # TcpExtRcvPruned                 61                 0.0
> ```

Ouch, bad things happened. Memory limits hit, and !tcp_can_ingest(skb).

> ```
> # TcpExtBeyondWindow              32                 0.0
> ```

I *think* (/wild guess) this can happen for packets in flight after while pruning is shrinking the receive buffer.

> ```
> # TcpExtTCPOFODrop                38                 0.0
> ```

More bad events

> ```
> # TcpExtTCPRcvQDrop               23                 0.0
> ```

Even more of them

I suspect some side effect of 1d2fbaad7cd8 ("tcp: stronger sk_rcvbuf checks") is hitting us again.

**Comment by pabeni** [comment]
I think the root cause of the problem is tcp-level autotuning and mptcp one have some substantial differences after 2da35e4b4df99 Merge branch 'tcp-receive-side-improvements'.

MPTCP sets the TCP-level rcvbuf size, but TCP can compute a different window/shrink it i.e. due to racing scaling_ratio update. That in turn may cause TCP-level drops that would lead to the above scenario.

At very best, the different auto-tuning logic used by MPTCP and TCP is a source of confusion: we need to update accordingly the MPTCP bits.

**Comment by matttbe** [comment]
@pabeni woaw, thank you for the analysis and the fix already!

I will try to look at the series you sent ASAP (probably not before Thursday). Because the "regression" is only in net-next, and if there are no major issues with it, do you think we could send the series or a part of it before net-next closes? v6.18 is going to be a LTS, that would be a shame to have a regression only in v6.18, and the fix in v6.19 :)

(maybe we can send the whole series or what's left in net after the release of v6.17)

**Comment by pabeni** [comment]
> will try to look at the series you sent ASAP (probably not before Thursday). Because the "regression" is only in net-next, and if there are no major issues with it, do you think we could send the series or a part of it before net-next closes? v6.18 is going to be a LTS, that would be a shame to have a regression only in v6.18, and the fix in v6.19 :)

@matttbe: The first 3 patches should be reasonably safe and I think/hope they could address the issue here (but I haven't verified such statement so far). Some testing will be needed. If that requires too much time for 6.18, but proves that the patches address the issue, we could send patch 2 and 3 to net.

**Comment by matttbe** [comment]
As suggested by Paolo, this issue has certainly been fixed by recent(ish) fixes from Paolo! Thanks again!
