### ISSUE TITLE
packetdrill: data are retransmitted after the `close()`

### ISSUE THREAD

**Issue by matttbe** [multipath-tcp/mptcp_net-next#400]
The public CI and the one from Tessares are reporting some instabilities with `TCP_FASTOPEN_CONNECT-no-cookie.pkt` packetdrill test:

```
# FAIL [/opt/packetdrill/gtests/net/mptcp/fastopen/client-TCP_FASTOPEN_CONNECT-no-cookie.pkt (ipv4-mapped-v6)]
# stdout: 
# stderr: 
# client-TCP_FASTOPEN_CONNECT-no-cookie.pkt:28: error handling packet: live packet payload: expected 0 bytes vs actual 1000 bytes
```

or with a different build:

```
# FAIL [/opt/packetdrill/gtests/net/mptcp/fastopen/client-TCP_FASTOPEN_CONNECT-no-cookie.pkt (ipv4)]
# stdout:
# stderr:
#  client-TCP_FASTOPEN_CONNECT-no-cookie.pkt:28: error handling packet:  live packet payload: expected 0 bytes vs actual 1000 bytes
```

So not always failing (v4, v4-v6, v6) but at least one seems to regularly fail. That's a new behaviour.

*EDIT*: It looks like it is not just with this test, see the last tests of `export-net`: [here](https://api.cirrus-ci.com/v1/artifact/task/4777665962442752/summary/summary.txt):

```
# FAIL [/opt/packetdrill/gtests/net/mptcp/add_addr/add_addr4_client.pkt (ipv6)]
# stdout: 
# stderr: 
# add_addr4_client.pkt:30: error handling packet: live packet payload: expected 0 bytes vs actual 100 bytes
(...)
# FAIL [/opt/packetdrill/gtests/net/mptcp/dss/dss_ssn_specified_server.pkt (ipv4)]
# stdout: 
# stderr: 
# dss_ssn_specified_server.pkt:26: error handling packet: live packet payload: expected 0 bytes vs actual 1000 bytes
```

**Comment by matttbe** [comment]
I managed to reproduce it (I hope) with packets traces and we can see unexpected retransmissions because packetdrill is too slow to inject packets. e.g. [mptcp-issue-400-packetdrill-2.zip](https://github.com/multipath-tcp/mptcp_net-next/files/11652737/mptcp-issue-400-packetdrill-2.zip)

```
# We get the SYN+ACK with < 1ms

09:56:29.788985  In  IP6 .47911 > .8080: Flags [S]  (...)
09:56:29.789318  Out IP6 .8080 > .47911: Flags [S.] (...)

# this ACK is received after 270ms

09:56:29.817204  Out IP6 .8080 > .47911: Flags [P.], seq 1:1001, ack 101 (...)
09:56:30.038193  Out IP6 .8080 > .47911: Flags [P.], seq 1:1001, ack 101 (...)
09:56:30.086187  In  IP6 .47911 > .8080: Flags [.], ack 1001 (...)
```

This can probably be fixed by adding more delay in the injected packets but it means modifying all packetdrill tests. Maybe it is enough to modify the delay between the SYN and the SYN+ACK?

Maybe we can change some sysctl to be less aggressive regarding the retransmissions?
- `tcp_early_retrans`
- `tcp_frto`

Note that it is still not clear to me what caused this between v6.3..v6.4-rc1

**Comment by matttbe** [comment]
I ran a `git bisect` last night:

```
echo 'for z in $(seq 11); do run_packetdrill_one mptcp/dss || true; grep -q "[l]ive packet payload:" "${OUTPUT_VIRTME}" && break; rm "${RESULTS_DIR}"/*.tap; done' > .virtme-exec-run
git bisect start v6.4-rc1 v6.3
MODE=debug STRESS=1 git bisect run ./.virtme_bisect.sh
```

Which gave me this:

```
# bad: [ac9a78681b921877518763ba0e89202254349d1b] Linux 6.4-rc1
# good: [457391b0380335d5e9a5babdec90ac53928b23b4] Linux 6.3
git bisect start 'v6.4-rc1' 'v6.3'
# good: [6e98b09da931a00bf4e0477d0fa52748bf28fcce] Merge tag 'net-next-6.4' of git://git.kernel.org/pub/scm/linux/kernel/git/netdev/net-next
git bisect good 6e98b09da931a00bf4e0477d0fa52748bf28fcce
# good: [70cc1b5307e8ee3076fdf2ecbeb89eb973aa0ff7] Merge tag 'powerpc-6.4-1' of git://git.kernel.org/pub/scm/linux/kernel/git/powerpc/linux
git bisect good 70cc1b5307e8ee3076fdf2ecbeb89eb973aa0ff7
# good: [865fdb08197e657c59e74a35fa32362b12397f58] Merge tag 'input-for-v6.4-rc0' of git://git.kernel.org/pub/scm/linux/kernel/git/dtor/input
git bisect good 865fdb08197e657c59e74a35fa32362b12397f58
# bad: [78b421b6a7c6dbb6a213877c742af52330f5026d] Merge tag 'linux-watchdog-6.4-rc1' of git://www.linux-watchdog.org/linux-watchdog
git bisect bad 78b421b6a7c6dbb6a213877c742af52330f5026d
# good: [7994beabfbb9a15c069eba7833a00f5ff4da1172] Merge tag 'dmaengine-6.4-rc1' of git://git.kernel.org/pub/scm/linux/kernel/git/vkoul/dmaengine
git bisect good 7994beabfbb9a15c069eba7833a00f5ff4da1172
# good: [667de5c68440732373f571f7eac4ff44b1b93ee7] Merge tag 'thermal-6.4-rc1-2' of git://git.kernel.org/pub/scm/linux/kernel/git/rafael/linux-pm
git bisect good 667de5c68440732373f571f7eac4ff44b1b93ee7
# good: [a1fd058b07d58c3372c1aba25dd65f1c9c9b65f1] Merge tag 'mm-hotfixes-stable-2023-05-03-16-27' of git://git.kernel.org/pub/scm/linux/kernel/git/akpm/mm
git bisect good a1fd058b07d58c3372c1aba25dd65f1c9c9b65f1
# good: [fe5631bb3a4bf62208ed52600c21dd3d1787f412] dt-bindings: watchdog: migrate rt2880 text bindings to YAML
git bisect good fe5631bb3a4bf62208ed52600c21dd3d1787f412
# good: [87b22656ca6a896d0378e9e60ffccb0c82f48b08] watchdog: menz069_wdt: fix watchdog initialisation
git bisect good 87b22656ca6a896d0378e9e60ffccb0c82f48b08
# bad: [8e15605be8baeb9e3957c268c7d6f901c327ad5c] Merge tag '9p-6.4-for-linus' of git://git.kernel.org/pub/scm/linux/kernel/git/ericvh/v9fs
git bisect bad 8e15605be8baeb9e3957c268c7d6f901c327ad5c
# good: [10f67d1fd275528e62109de2ece26371833638e5] watchdog: dw_wdt: Simplify clk management
git bisect good 10f67d1fd275528e62109de2ece26371833638e5
# good: [aaf67de78807c59c35bafb5003d4fb457c764800] ceph: fix potential use-after-free bug when trimming caps
git bisect good aaf67de78807c59c35bafb5003d4fb457c764800
# good: [db2993a423e3fd0e4878f4d3ac66fe717f5f072e] ceph: reorder fields in 'struct ceph_snapid_map'
git bisect good db2993a423e3fd0e4878f4d3ac66fe717f5f072e
# bad: [3c4aa44343777844e425c28f1427127f3e55826f] Merge tag 'ceph-for-6.4-rc1' of https://github.com/ceph/ceph-client
git bisect bad 3c4aa44343777844e425c28f1427127f3e55826f
# bad: [6deffc8924b59df173da5fc7a9c96d3717cd9e96] fs/9p: Add new mount modes
git bisect bad 6deffc8924b59df173da5fc7a9c96d3717cd9e96
# bad: [740b8bf87322701b4607b77346477cbc764f5c56] fs/9p: Remove unnecessary superblock flags
git bisect bad 740b8bf87322701b4607b77346477cbc764f5c56
# bad: [d9bc0d11e33bd7b6bfeedc570cd5738e5b4c7ca8] fs/9p: Consolidate file operations and add readahead and writeback
git bisect bad d9bc0d11e33bd7b6bfeedc570cd5738e5b4c7ca8
# first bad commit: [d9bc0d11e33bd7b6bfeedc570cd5738e5b4c7ca8] fs/9p: Consolidate file operations and add readahead and writeback
```

It looks like the issue is caused by the recent modifications on 9p side: 8e15605be8baeb9e3957c268c7d6f901c327ad5c

If I revert this series, I can no longer reproduce the error:

```
git log --oneline --reverse v6.3-rc1..21e26d5e54ab
d9bc0d11e33b fs/9p: Consolidate file operations and add readahead and writeback
740b8bf87322 fs/9p: Remove unnecessary superblock flags
8142db4f2792 fs/9p: allow disable of xattr support on mount
46c30cb8f539 9p: Add additional debug flags and open modes
6deffc8924b5 fs/9p: Add new mount modes
1543b4c5071c fs/9p: remove writeback fid and fix per-file modes
4eb3117888a9 fs/9p: Rework cache modes and add new options to Documentation
21e26d5e54ab fs/9p: Fix bit operation logic error
```

I'm going to report the issue to 9p devs on their mailing list.

EDIT: just in case, here is the output of the following command:
[pktdrill-strace.zip](https://github.com/multipath-tcp/mptcp_net-next/files/11665454/pktdrill-strace.zip)

```
strace -rtt ../packetdrill/packetdrill dss/mpc_with_data_client.pkt
```

We don't see many files being opened:

```
$ grep / pktdrill.strace | grep -v "/\*"
13:47:30.175276 (+     0.005222) access("/etc/ld.so.preload", R_OK) = -1 ENOENT (No such file or directory)
13:47:30.179941 (+     0.004917) openat(AT_FDCWD, "/etc/ld.so.cache", O_RDONLY|O_CLOEXEC) = 3
13:47:30.197425 (+     0.004071) openat(AT_FDCWD, "/lib/x86_64-linux-gnu/libc.so.6", O_RDONLY|O_CLOEXEC) = 3
13:47:30.326335 (+     0.005312) newfstatat(AT_FDCWD, "dss/mpc_with_data_client.pkt", {st_mode=S_IFREG|0644, st_size=1859, ...}, 0) = 0
13:47:30.330761 (+     0.004386) openat(AT_FDCWD, "dss/mpc_with_data_client.pkt", O_RDONLY) = 3
13:47:30.335068 (+     0.004065) read(3, "// connect() function, connectio"..., 1860) = 1859
13:47:30.354111 (+     0.011258) openat(AT_FDCWD, "/dev/urandom", O_RDONLY) = 3
13:47:30.371491 (+     0.004087) openat(AT_FDCWD, "/sys/devices/system/cpu/online", O_RDONLY|O_CLOEXEC) = 4
13:47:31.954143 (+     0.004156) openat(AT_FDCWD, "/dev/net/tun", O_RDWR) = 4
```

**Comment by matttbe** [comment]
I recently noticed some patches fixing some issues in 9p in Linus tree (they conflicted with our revert of the 6.4 PR). It looks like we no longer have the issue when validating Linus tree.

After a quick `git bisect`, it seems the bug is fixed thanks to 350cd9b95975 ("`fs/9p: remove unnecessary invalidate_inode_pages2`").

I'm going to remove the revert on our side and close this issue.

**Comment by matttbe** [comment]
Fixes with:

- bda42b8cade7 ("`Revert "Revert "Merge tag '9p-6.4-for-linus' of git://git.kernel.org/pub/scm/linux/kernel/git/ericvh/v9fs""`")
- Results: 86fd832586e7..ac7131f5e40c (export)

Tests are now in progress:

https://cirrus-ci.com/github/multipath-tcp/mptcp_net-next/export/20230807T150414
