### ISSUE TITLE
Problems encountered in setting up subflows

### ISSUE THREAD

**Issue by cwx5201314** [multipath-tcp/mptcp_net-next#569]
### Pre-requisites

- [ ] A similar [question](https://github.com/multipath-tcp/mptcp_net-next/issues?q=label%3question) has not been reported before.
- [ ] [mptcp.dev](https://www.mptcp.dev) website does not cover my case.
- [ ] The [wiki](https://github.com/multipath-tcp/mptcp_net-next/wiki) doesn't cover my case.
- [ ] This is not a question related to the current behavior, an issue or a feature requst: if it is, please use [another template](https://github.com/multipath-tcp/mptcp_net-next/issues/new/choose) **even if it is a question**: we will need details about your system: kernel version, config, etc.

### My question

My Ubuntu version is 18.04, and the kernel version is 5.4.230.mptcp. I'm a networking beginner, and I'm trying to set up a simple MPTCP connection. However, I've noticed that only the main flow works in my connection, while the subflows don't function at all.I'd like to know what I should do to fix this issue.This is my code.

```
#!/usr/bin/python

"""
   __ s1 __
  /__ s2 __\
h1    ..    h2
  \__ sn __/
"""
import os
import time
from mininet.topo import Topo
from mininet.net import Mininet
from mininet.util import dumpNodeConnections
from mininet.log import setLogLevel
from mininet.cli import CLI
from mininet.link import TCLink

class CustomTopo(Topo):

    def build(self, n = 2):
        h1 = self.addHost('h1', ip = '10.0.1.1')
        h2 = self.addHost('h2', ip = '10.0.2.1')

        for i in range(n):
           switch = self.addSwitch('s%s' % (i+1))
           self.addLink(h1, switch, cls = TCLink, bw = 1,  delay='10ms')
           self.addLink(switch, h2, cls = TCLink, bw = 1)
           
def create(n):
     print('*** building mininet topology')
     topo = CustomTopo(n)
     net = Mininet(topo, link = TCLink)
     net.start()
     print('*** mininet created successfully')
     
     print('*** configure network')
     h1 = net.get('h1')
     h2 = net.get('h2')     
     config_network(net, h1, h2, n)
          
     print('*** routing table for h1')
     print(h1.cmd('ip route'))
     print('*** routing table for h2')
     print(h2.cmd('ip route'))
     
     print('*** running client-server application')
     #h1.cmd('python3 ./apps/server.py &> ./logs/server.log &')
     #time.sleep(2)
     #h2.cmd('python3 ./apps/client.py &> ./logs/client.log')
     h1.cmd('mkdir -p ./logs')
     h1.cmd('iperf -s &> ./logs/server.log &')
     time.sleep(2)
     h2.cmd('mkdir -p ./logs')
     h2.cmd('iperf -i 1 -n 3M -c 10.0.1.1 &> ./logs/client.log')
     
     #link failures
     #time.sleep(5)
     #h1.intf('h1-eth0').ifconfig('down')
     #time.sleep(5)
     #h1.intf('h1-eth0').ifconfig('up')
     
     print('*** communication completed')
          
     CLI(net)
     
     net.stop()
     
def config_network(net, h1, h2, n):
    for i in range(n):    
        h1.setIP('10.0.1.' + str(i+1), intf='h1-eth' + str(i))
        h2.setIP('10.0.2.' + str(i+1), intf='h2-eth' + str(i))  
     
if __name__ == '__main__':
    n = 3
    setLogLevel('info')    
    create(n)
```

Below is the content I captured in Wireshark from h1-eth0

```
"170","1.780657801","10.0.1.1","10.0.2.1","MPTCP","74","5001  >  59470 [ACK] Seq=1 Ack=85681 Win=212992 Len=0 TSval=2672226863 TSecr=3902283095"
"171","1.794135101","10.0.2.1","10.0.1.1","MPTCP","2942","59470  >  5001 [PSH, ACK] Seq=85681 Ack=1 Win=126976 Len=2856 TSval=3902283099 TSecr=2672226705"
"172","1.804222350","10.0.1.1","10.0.2.1","MPTCP","74","5001  >  59470 [ACK] Seq=1 Ack=88537 Win=218624 Len=0 TSval=2672226886 TSecr=3902283099"
"173","1.818312191","10.0.2.1","10.0.1.3","MPTCP","2942","35227  >  5001 [PSH, ACK] Seq=62833 Ack=1 Win=126976 Len=2856 TSval=3606520818 TSecr=2894112384"
"174","1.828851812","10.0.1.3","10.0.2.1","MPTCP","74","5001  >  35227 [ACK] Seq=1 Ack=65689 Win=224256 Len=0 TSval=2894112663 TSecr=3606520818"
"175","1.842998410","10.0.2.1","10.0.1.3","MPTCP","2942","35227  >  5001 [PSH, ACK] Seq=65689 Ack=1 Win=126976 Len=2856 TSval=3606520855 TSecr=2894112506"
"176","1.854052599","10.0.1.3","10.0.2.1","MPTCP","74","5001  >  35227 [ACK] Seq=1 Ack=68545 Win=229888 Len=0 TSval=2894112687 TSecr=3606520855"
"177","1.866961793","10.0.2.1","10.0.1.2","MPTCP","2942","51873  >  5001 [PSH, ACK] Seq=61405 Ack=1 Win=126976 Len=2856 TSval=3170046459 TSecr=2183993133"
"178","1.877455198","10.0.1.2","10.0.2.1","MPTCP","74","5001  >  51873 [ACK] Seq=1 Ack=64261 Win=235520 Len=0 TSval=2183993411 TSecr=3170046459"
"179","1.891305684","10.0.2.1","10.0.1.2","MPTCP","2942","51873  >  5001 [PSH, ACK] Seq=64261 Ack=1 Win=126976 Len=2856 TSval=3170046484 TSecr=2183993266"
"180","1.902292399","10.0.1.2","10.0.2.1","MPTCP","74","5001  >  51873 [ACK] Seq=1 Ack=67117 Win=241152 Len=0 TSval=2183993436 TSecr=3170046484"
"181","1.915143374","10.0.2.1","10.0.1.1","MPTCP","2942","59470  >  5001 [PSH, ACK] Seq=88537 Ack=1 Win=126976 Len=2856 TSval=3902283233 TSecr=2672226729"
"182","1.925711409","10.0.1.1","10.0.2.1","MPTCP","74","5001  >  59470 [ACK] Seq=1 Ack=91393 Win=246784 Len=0 TSval=2672227007 TSecr=3902283233"
"183","1.940883545","10.0.2.1","10.0.1.1","MPTCP","2942","59470  >  5001 [PSH, ACK] Seq=91393 Ack=1 Win=126976 Len=2856 TSval=3902283256 TSecr=2672226863"
"184","1.951427009","10.0.1.1","10.0.2.1","MPTCP","74","5001  >  59470 [ACK] Seq=1 Ack=94249 Win=252928 Len=0 TSval=2672227033 TSecr=3902283256"
"185","1.963631250","10.0.2.1","10.0.1.3","MPTCP","1514","35227  >  5001 [ACK] Seq=68545 Ack=1 Win=126976 Len=1428 TSval=3606520976 TSecr=2894112542"
"186","1.974204906","10.0.1.3","10.0.2.1","MPTCP","74","5001  >  35227 [ACK] Seq=1 Ack=69973 Win=255488 Len=0 TSval=2894112808 TSecr=3606520976"
"187","1.976565415","10.0.2.1","10.0.1.3","MPTCP","2942","35227  >  5001 [PSH, ACK] Seq=69973 Ack=1 Win=126976 Len=2856 TSval=3606520976 TSecr=2894112542"
"188","1.986821198","10.0.1.3","10.0.2.1","MPTCP","74","5001  >  35227 [ACK] Seq=1 Ack=72829 Win=261120 Len=0 TSval=2894112821 TSecr=3606520976"
"189","2.000543796","10.0.2.1","10.0.1.3","MPTCP","2942","35227  >  5001 [PSH, ACK] Seq=72829 Ack=1 Win=126976 Len=2856 TSval=3606521000 TSecr=2894112663"
"190","2.010761449","10.0.1.3","10.0.2.1","MPTCP","74","5001  >  35227 [ACK] Seq=1 Ack=75685 Win=267264 Len=0 TSval=2894112845 TSecr=3606521000"
"191","2.024796809","10.0.2.1","10.0.1.2","MPTCP","2942","51873  >  5001 [PSH, ACK] Seq=67117 Ack=1 Win=126976 Len=2856 TSval=3170046604 TSecr=2183993291"
"192","2.035320050","10.0.1.2","10.0.2.1","MPTCP","74","5001  >  51873 [ACK] Seq=1 Ack=69973 Win=272896 Len=0 TSval=2183993569 TSecr=3170046604"
"193","2.048697105","10.0.2.1","10.0.1.2","MPTCP","2942","51873  >  5001 [PSH, ACK] Seq=69973 Ack=1 Win=126976 Len=2856 TSval=3170046629 TSecr=2183993411"
"194","2.058838882","10.0.1.2","10.0.2.1","MPTCP","74","5001  >  51873 [ACK] Seq=1 Ack=72829 Win=278528 Len=0 TSval=2183993593 TSecr=3170046629"
"195","2.073012011","10.0.2.1","10.0.1.1","MPTCP","2942","59470  >  5001 [PSH, ACK] Seq=94249 Ack=1 Win=126976 Len=2856 TSval=3902283398 TSecr=2672227007"
"196","2.083451497","10.0.1.1","10.0.2.1","MPTCP","74","5001  >  59470 [ACK] Seq=1 Ack=97105 Win=284160 Len=0 TSval=2672227165 TSecr=3902283398"
"197","2.097049693","10.0.2.1","10.0.1.1","MPTCP","2942","59470  >  5001 [PSH, ACK] Seq=97105 Ack=1 Win=126976 Len=2856 TSval=3902283403 TSecr=2672227007"
"198","2.107373985","10.0.1.1","10.0.2.1","MPTCP","74","5001  >  59470 [ACK] Seq=1 Ack=99961 Win=289792 Len=0 TSval=2672227189 TSecr=3902283403"
"199","2.121757072","10.0.2.1","10.0.1.3","MPTCP","1514","35227  >  5001 [ACK] Seq=75685 Ack=1 Win=126976 Len=1428 TSval=3606521133 TSecr=2894112687"
"200","2.132301342","10.0.1.3","10.0.2.1","MPTCP","74","5001  >  35227 [ACK] Seq=1 Ack=77113 Win=292864 Len=0 TSval=2894112966 TSecr=3606521133"
"201","2.133827724","10.0.2.1","10.0.1.3","MPTCP","2942","35227  >  5001 [PSH, ACK] Seq=77113 Ack=1 Win=126976 Len=2856 TSval=3606521133 TSecr=2894112687"
"202","2.144007695","10.0.1.3","10.0.2.1","MPTCP","74","5001  >  35227 [ACK] Seq=1 Ack=79969 Win=298496 Len=0 TSval=2894112978 TSecr=3606521133"
"203","2.158252015","10.0.2.1","10.0.1.3","MPTCP","2942","35227  >  5001 [PSH, ACK] Seq=79969 Ack=1 Win=126976 Len=2856 TSval=3606521157 TSecr=2894112821"
```

Below is the content I captured in Wireshark from h2-eth2

```
"No.","Time","Source","Destination","Protocol","Length","Info"
"1","0.000000000","5a:1a:18:3f:42:3b","Broadcast","ARP","42","Who has 10.0.1.1? Tell 10.0.2.3"
"2","0.000006644","5a:1a:18:3f:42:3b","Broadcast","ARP","42","Who has 10.0.1.3? Tell 10.0.2.3"
"3","0.000013477","5a:1a:18:3f:42:3b","Broadcast","ARP","42","Who has 10.0.1.2? Tell 10.0.2.3"
"4","1.023849224","5a:1a:18:3f:42:3b","Broadcast","ARP","42","Who has 10.0.1.2? Tell 10.0.2.3"
"5","1.023854835","5a:1a:18:3f:42:3b","Broadcast","ARP","42","Who has 10.0.1.3? Tell 10.0.2.3"
"6","1.023856779","5a:1a:18:3f:42:3b","Broadcast","ARP","42","Who has 10.0.1.1? Tell 10.0.2.3"
"7","2.047705973","5a:1a:18:3f:42:3b","Broadcast","ARP","42","Who has 10.0.1.1? Tell 10.0.2.3"
"8","2.047709430","5a:1a:18:3f:42:3b","Broadcast","ARP","42","Who has 10.0.1.3? Tell 10.0.2.3"
"9","2.047712707","5a:1a:18:3f:42:3b","Broadcast","ARP","42","Who has 10.0.1.2? Tell 10.0.2.3"
"10","6.155748931","fe80::e093:e5ff:fe8a:6f0c","ff02::2","ICMPv6","70","Router Solicitation from e2:93:e5:8a:6f:0c"
"11","10.239734192","fe80::649b:d5ff:fead:ab75","ff02::2","ICMPv6","70","Router Solicitation from 66:9b:d5:ad:ab:75"
"12","10.239741126","fe80::581a:18ff:fe3f:423b","ff02::2","ICMPv6","70","Router Solicitation from 5a:1a:18:3f:42:3b"
"13","10.497703575","fe80::649b:d5ff:fead:ab75","ff02::fb","MDNS","107","Standard query 0x0000 PTR _ipps._tcp.local, ""QM"" question PTR _ipp._tcp.local, ""QM"" question"
```

**Comment by matttbe** [comment]
Hello,

> My Ubuntu version is 18.04, and the kernel version is 5.4.230.mptcp.

Sadly, this kernel is no longer supported. It was developed there: https://github.com/multipath-tcp/mptcp

Please use the new kernel implementation which is in mainline Linux. Ideally the latest stable (6.15) or LTS version (6.12), see: https://www.kernel.org
